{
  "version": "1.0",
  "style_playbook": "clean-professional",
  "scenes": [
    {
      "id": "scene_opener",
      "type": "generated",
      "description": "opener — center title card with video title under the hook",
      "start_seconds": 0.0,
      "end_seconds": 3.0,
      "script_section_id": "section_opener",
      "framing": "wide",
      "movement": "static",
      "transition_in": "fade_in",
      "transition_out": "cut",
      "shot_language": {
        "shot_size": "wide",
        "camera_movement": "static",
        "lens_mm": 24,
        "lighting_key": "low_key",
        "depth_of_field": "deep",
        "color_temperature": "cool"
      },
      "shot_intent": "establish the video's thesis with an authoritative title card",
      "narrative_role": "establish_context",
      "information_role": "opener — center title card with video title under the hook",
      "hero_moment": true,
      "texture_keywords": ["clean", "professional"],
      "required_assets": [
        { "type": "animation", "description": "opener — center title card with video title under the hook", "source": "generate" }
      ]
    },
    {
      "id": "scene_01",
      "type": "generated",
      "description": "hook — NATO eastward-expansion arrow over Baltic/Eastern Europe while the warning line lands",
      "start_seconds": 3.0,
      "end_seconds": 14.064,
      "script_section_id": "section_01",
      "framing": "wide",
      "movement": "static",
      "transition_in": "cut",
      "transition_out": "cut",
      "shot_language": {
        "shot_size": "extreme_wide",
        "camera_movement": "static",
        "lens_mm": 24,
        "lighting_key": "low_key",
        "depth_of_field": "deep",
        "color_temperature": "cool"
      },
      "shot_intent": "visualize the coincidence the hook posits: NATO expansion timing clashes with the drill",
      "narrative_role": "build_tension",
      "information_role": "hook — NATO eastward-expansion arrow over Baltic/Eastern Europe while the warning line lands",
      "hero_moment": true,
      "texture_keywords": ["clean", "professional"],
      "required_assets": [
        { "type": "animation", "description": "hook — NATO eastward-expansion arrow over Baltic/Eastern Europe", "source": "generate" }
      ]
    },
    {
      "id": "scene_chapter_1",
      "type": "generated",
      "description": "chapter 1 break — lower-mode title card into the airborne-forces analysis",
      "start_seconds": 14.064,
      "end_seconds": 16.564,
      "script_section_id": "section_chapter_1",
      "framing": "wide",
      "movement": "static",
      "transition_in": "cut",
      "transition_out": "cut",
      "shot_language": {
        "shot_size": "wide",
        "camera_movement": "static",
        "lens_mm": 24,
        "lighting_key": "low_key",
        "depth_of_field": "deep",
        "color_temperature": "cool"
      },
      "shot_intent": "mark the transition from hook to the core analysis",
      "narrative_role": "transition",
      "information_role": "chapter 1 break — lower-mode title card into the airborne-forces analysis",
      "hero_moment": false,
      "texture_keywords": ["clean", "professional"],
      "required_assets": [
        { "type": "animation", "description": "chapter 1 break — lower-mode title card", "source": "generate" }
      ]
    },
    {
      "id": "scene_02a",
      "type": "generated",
      "description": "segment 2a — airborne unit icons: high-mobility rapid-response strategic projection force",
      "start_seconds": 16.564,
      "end_seconds": 29.353,
      "script_section_id": "section_02",
      "framing": "wide",
      "movement": "static",
      "transition_in": "cut",
      "transition_out": "cut",
      "shot_language": {
        "shot_size": "wide",
        "camera_movement": "static",
        "lens_mm": 24,
        "lighting_key": "low_key",
        "depth_of_field": "deep",
        "color_temperature": "cool"
      },
      "shot_intent": "show airborne units as a high-mobility rapid-response strategic projection force",
      "narrative_role": "introduce_subject",
      "information_role": "segment 2a — airborne unit icons: what makes the air assault force a strategic projection force",
      "hero_moment": false,
      "texture_keywords": ["clean", "professional"],
      "required_assets": [
        { "type": "animation", "description": "airborne unit icons — high mobility, rapid response, strategic projection", "source": "generate" }
      ]
    },
    {
      "id": "scene_02b",
      "type": "generated",
      "description": "segment 2b — cross-domain coordination org chart: from basic drills to joint-system cooperation",
      "start_seconds": 29.353,
      "end_seconds": 41.441,
      "script_section_id": "section_02",
      "framing": "wide",
      "movement": "static",
      "transition_in": "cut",
      "transition_out": "cut",
      "shot_language": {
        "shot_size": "wide",
        "camera_movement": "static",
        "lens_mm": 24,
        "lighting_key": "low_key",
        "depth_of_field": "deep",
        "color_temperature": "cool"
      },
      "shot_intent": "contrast basic drills vs real cross-system joint coordination",
      "narrative_role": "build_tension",
      "information_role": "segment 2b — the exercise is real cross-system coordination, not basic drills",
      "hero_moment": false,
      "texture_keywords": ["clean", "professional"],
      "required_assets": [
        { "type": "animation", "description": "cross-domain coordination chart — joint-system cooperation structure", "source": "generate" }
      ]
    },
    {
      "id": "scene_02c",
      "type": "generated",
      "description": "segment 2c — forward radar/EW warning: demonstrating coordination capability is the deterrent signal",
      "start_seconds": 41.441,
      "end_seconds": 47.572,
      "script_section_id": "section_02",
      "framing": "wide",
      "movement": "static",
      "transition_in": "cut",
      "transition_out": "cut",
      "shot_language": {
        "shot_size": "medium_wide",
        "camera_movement": "static",
        "lens_mm": 24,
        "lighting_key": "low_key",
        "depth_of_field": "deep",
        "color_temperature": "cool"
      },
      "shot_intent": "land the point: showing coordination ability at the forward node is the most direct deterrent signal",
      "narrative_role": "deliver_payload",
      "information_role": "segment 2c — the rapid-response cooperation template as a deterrent signal",
      "hero_moment": false,
      "texture_keywords": ["clean", "professional"],
      "required_assets": [
        { "type": "animation", "description": "forward radar/EW sweep — deterrent signal of demonstrated coordination", "source": "generate" }
      ]
    },
    {
      "id": "scene_03a",
      "type": "generated",
      "description": "segment 3a — dual-front map: NATO reaches toward both ends of the Eurasian continent",
      "start_seconds": 47.572,
      "end_seconds": 58.653,
      "script_section_id": "section_03",
      "framing": "wide",
      "movement": "static",
      "transition_in": "cut",
      "transition_out": "cut",
      "shot_language": {
        "shot_size": "extreme_wide",
        "camera_movement": "static",
        "lens_mm": 24,
        "lighting_key": "low_key",
        "depth_of_field": "deep",
        "color_temperature": "cool"
      },
      "shot_intent": "show NATO's tentacles reaching toward both ends of Eurasia at once",
      "narrative_role": "build_tension",
      "information_role": "segment 3a — NATO spreading into the Pacific and pressing Eurasia from both ends",
      "hero_moment": false,
      "texture_keywords": ["clean", "professional"],
      "required_assets": [
        { "type": "animation", "description": "dual-front squeeze map — NATO presses from Baltic/E. Europe and the W. Pacific", "source": "generate" }
      ]
    },
    {
      "id": "scene_03b",
      "type": "generated",
      "description": "segment 3b — tactics: west front Baltic/E. Europe presses Russia, east front island-chain deployment",
      "start_seconds": 58.653,
      "end_seconds": 69.734,
      "script_section_id": "section_03",
      "framing": "wide",
      "movement": "static",
      "transition_in": "cut",
      "transition_out": "cut",
      "shot_language": {
        "shot_size": "extreme_wide",
        "camera_movement": "static",
        "lens_mm": 24,
        "lighting_key": "low_key",
        "depth_of_field": "deep",
        "color_temperature": "cool"
      },
      "shot_intent": "show the two-front squeeze: Baltic/E. Europe in the west, island chain in the W. Pacific",
      "narrative_role": "deliver_payload",
      "information_role": "segment 3b — the dual-front pincer press against Russia and the island-chain deployment",
      "hero_moment": false,
      "texture_keywords": ["clean", "professional"],
      "required_assets": [
        { "type": "animation", "description": "tactical pincer diagram — two-front squeeze and island-chain deployment", "source": "generate" }
      ]
    },
    {
      "id": "scene_03c",
      "type": "generated",
      "description": "segment 3c — satellite: China-Belarus airborne cooperation as the mid-continent hub, transparency on the table",
      "start_seconds": 69.734,
      "end_seconds": 83.068,
      "script_section_id": "section_03",
      "framing": "wide",
      "movement": "static",
      "transition_in": "cut",
      "transition_out": "cut",
      "shot_language": {
        "shot_size": "wide",
        "camera_movement": "static",
        "lens_mm": 24,
        "lighting_key": "low_key",
        "depth_of_field": "deep",
        "color_temperature": "cool"
      },
      "shot_intent": "show the Belarus buffer zone and the China-Belarus airborne cooperation at the Eurasian mid-continent hub",
      "narrative_role": "deliver_payload",